{"authority":"CANONICAL_RECORD","concurrency":{"declared_source_fingerprint":"sha256:45a704eb4a7b8fff43ebb7982cacfb78de1c67533c3bedf9791380011a48f391","expected_main_sha":"d53070403a7cdd84d800cbf3519c3456f5e6f9bd","expected_parent_feather":"FTR-DI2NRWYNLEBRSNY7TX6F4YIFMY","expected_quest_revision":3},"current_entry_id":"Main-Gate-003","current_position":"Mission #339 is CLOSED and CANONICAL at d53070403a7cdd84d800cbf3519c3456f5e6f9bd. Mission #338 remains the sole active Sunset attempt. Mission #333 is closed not planned, PR #337 is closed unmerged, and Prime Ascendant remains IN_PROGRESS at PA-C01-COVENANT-REFINEMENT.","durable_source_references":[{"authority":"CANONICAL_SOURCE","ref_id":"prime-ascendant-quest","uri":"quests/prime-ascendant.md"},{"authority":"CANONICAL_SOURCE","ref_id":"prime-ascendant-covenant","uri":"quests/prime-ascendant-covenant.md"},{"authority":"CANONICAL_SOURCE","ref_id":"mission-control-contract","uri":"governance/mission-control-interaction-contract.md"},{"authority":"CANONICAL_SOURCE","ref_id":"mission-first-handoff","uri":"governance/mission-first-chat-handoff-contract.md"},{"authority":"CANONICAL_SOURCE","ref_id":"lifecycle-contract","uri":"lifecycle/lifecycle-contract.md"},{"authority":"CANONICAL_SOURCE","ref_id":"sunset-router-contract","uri":"governance/sunset-router-contract.md"},{"authority":"CANONICAL_SOURCE","ref_id":"lesson-harvest-protocol","uri":"governance/lesson-harvest-protocol.md"},{"authority":"CANONICAL_SOURCE","ref_id":"prime-continuity-register","uri":"continuity/prime-continuity-register-r01.json"},{"authority":"CANONICAL_SOURCE","ref_id":"quest-registry","uri":"continuity/mission-board-quest-registry-r01.json"}],"journey_entries":[{"active_direction":null,"branched_from":null,"entry_id":"Main-Gate-001","entry_type":"MAIN","outcome":null,"reason":null,"returns_to":null,"scope":"GATE","sequence":1,"summary":"The campaign repaired a semantic collision between Atlas Sunset and a low-level continuity command, established lesson-harvest governance and campaign control, enforced Feather/Sunset/Sunrise bindings, reconciled Prime Ascendant after PRs 236 and 237, and reached the final authored closeout without authorizing runtime, infrastructure, Gitea cutover, route retirement, or repository settings.","superseded_direction":null},{"active_direction":null,"branched_from":null,"entry_id":"Main-Gate-002","entry_type":"MAIN","outcome":null,"reason":null,"returns_to":null,"scope":"GATE","sequence":2,"summary":"This normal full Atlas Sunset closes the chat while preserving the exact durable results and restart context. PR #245 merged the Atlas naming architecture refraction; PR #246 merged the deterministic generated refresh; and PR #247 merged Prime Integrity plus the future Gitea/Phoenix validation augmentation. Prime Ascendant is only the admitted-Quest continuity scope and remains ACTIVE — ARCHITECTURE REFINEMENT at PA-C01-COVENANT-REFINEMENT. Runtime is NOT STARTED, Gitea cutover is NOT AUTHORIZED, and legacy route retirement is NOT AUTHORIZED. The future validation route remains Gitea pull-request event to Prime Integrity Cognitive Shadow, immutable exact-base/exact-head carrier, bounded Kandra executor, conditional Windows executor, TenSoon verification, Phoenix draft/status publication, Athena audit, and Jayson-controlled permanence. No deployment, activation, settings, ruleset, cutover, runtime, or route-retirement action occurred.","superseded_direction":null},{"active_direction":null,"branched_from":null,"entry_id":"Main-Gate-003","entry_type":"MAIN","outcome":null,"reason":null,"returns_to":null,"scope":"GATE","sequence":3,"summary":"Corrected compiler-valid Sunset Preview for the same Mission #338 attempt under Stormfather campaign Mission #340. Mission #339 and PR #341 are canonically complete and independently read back. The Relay design, Strikeforce findings, Stormfather campaign binding, and Mission Board evidence remain public-clean context.","superseded_direction":null}],"latest_feather_id":"FTR-DUXR2GP55SINPLJFGXMVTIU47D","lineage_root_id":"QEM-KYPFUDPMKFMO4UHFJGZMINITSO","next_gate":"After canonical readback reports SUNSET COMPLETE and closes Mission #338, close parent Mission #340 while preserving Prime Ascendant at PA-C01-COVENANT-REFINEMENT.","operation_ids":["operation-harmony","operation-nexus"],"project_id":"project-artemis","protected_data":{"classification":"INTERNAL_CLEAN","clean_summary":"Only public-clean repository, Mission, campaign, PR, lifecycle, decision, validation, blocker, dependency, rollback, and continuity identities are included.","protected_pointers":[]},"quest_id":"prime-ascendant","quest_revision":3,"quest_state":"IN_PROGRESS","record_id":"QEM-KYPFUDPMKFMO4UHFJGZMINITSO","revision_parent_digest":"sha256:e0d3cf807b9f7cf3d8278fc7f5c22d6d2926057fd672611ffc806932dc62abbc","schema_id":"atlas.lifecycle.quest-emberline","schema_version":"2.0.0","unresolved_blockers":["PA-C01 Covenant acceptance and the architecture decisions listed in the Covenant remain unresolved by design.","Runtime, infrastructure, database, webhook, Gitea, cutover, route retirement, settings, ruleset, recovery, and protected-data authority remain unauthorized."]}
