{"authority":"CANONICAL_RECORD","concurrency":{"declared_source_fingerprint":"sha256:8a466ed15f362668c55ff037768f2fe9f4f793772fc108f467f35404c59ad5f3","expected_main_sha":"40e58dcf33bae68f8c819c2f65c6474f52381718","expected_parent_feather":"FTR-NSTEALUEMBITCO27XTBC2542XN","expected_quest_revision":4},"current_entry_id":"Final-Gate-007","current_position":"Repairing Prime is COMPLETE and CLOSED. RP-C08 is COMPLETE; AJ-01 through AJ-12 remain PROVEN; all 28 capability dispositions remain reconciled; restart-safe Sunset PR #224 and generated NOOP run 29536662886 close the final source and generated-current prerequisites. Independent Quests remain unchanged.","durable_source_references":[{"authority":"CANONICAL_SOURCE","digest":"sha256:5965d7b6ad600e5378e98b32383d7eccdb6c0bbc198dcd3814577276c85f2c7c","ref_id":"repairing-prime-source","uri":"quests/repairing-prime.md"},{"authority":"CANONICAL_SOURCE","digest":"sha256:839368353c91749725fe956e7859e50f53dd2552fa77911c4abe329db67bacf6","ref_id":"lifecycle-contract","uri":"lifecycle/lifecycle-contract.md"},{"authority":"CANONICAL_SOURCE","digest":"sha256:1c2d99a8ac0786c7a1981301f2427dadb24d44081f0c7077fb46a9ac0fcd9f04","ref_id":"capability-acceptance-contract","uri":"governance/capability-acceptance-contract.md"},{"authority":"CANONICAL_SOURCE","digest":"sha256:6e9c46ba4dd82caf977be2a355d0a59650b018cd82ae1ce627df2c86b7268381","ref_id":"prime-continuity-register","uri":"continuity/prime-continuity-register-r01.json"}],"journey_entries":[{"active_direction":null,"branched_from":null,"entry_id":"Main-Emberline-001","entry_type":"MAIN","outcome":null,"reason":null,"returns_to":null,"scope":"EMBERLINE","sequence":1,"summary":"Repairing Prime established the original restoration route from accepted Prime source and continuity.","superseded_direction":null},{"active_direction":null,"branched_from":null,"entry_id":"Main-Mission-002","entry_type":"MAIN","outcome":null,"reason":null,"returns_to":null,"scope":"MISSION","sequence":2,"summary":"AJ-01 through AJ-12, all 28 capability dispositions, generated-current state, whole-Quest Strikeforce, and Phoenix recovery were accepted.","superseded_direction":null},{"active_direction":null,"branched_from":"Main-Mission-002","entry_id":"Side-Mission-003","entry_type":"SIDE","outcome":"PR #221 was preserved as DEFLECTED evidence and was not merged.","reason":"The candidate created a second content-addressed Emberline identity instead of advancing the existing Quest journey.","returns_to":"Branched-Emberline-005","scope":"MISSION","sequence":3,"summary":"Restart-safe Sunset R01 generated a five-record candidate that conflicted with the one-current-Emberline validator.","superseded_direction":null},{"active_direction":null,"branched_from":"Side-Mission-003","entry_id":"Side-Gate-004","entry_type":"SIDE","outcome":"The six-path deletion proposal was rejected before execution.","reason":"Deleting the prior Emberline would break its immutable checkpoint reference and the successor lineage reference.","returns_to":"Branched-Emberline-005","scope":"GATE","sequence":4,"summary":"The delete-and-replace repair was independently Strikeforced.","superseded_direction":null},{"active_direction":"Update one stable Quest Emberline file in place while preserving prior revisions in Git and immutable lifecycle evidence.","branched_from":"Side-Gate-004","entry_id":"Branched-Emberline-005","entry_type":"BRANCHED","outcome":null,"reason":"The former model confused immutable historical records with the single readable current Quest journey.","returns_to":null,"scope":"EMBERLINE","sequence":5,"summary":"Repairing Prime intentionally adopted one stable living Emberline that records Main, Side, Branched, and Final journey entries.","superseded_direction":"Create a new content-addressed Quest Emberline file for every current-state revision."},{"active_direction":null,"branched_from":null,"entry_id":"Main-Gate-006","entry_type":"MAIN","outcome":null,"reason":null,"returns_to":null,"scope":"GATE","sequence":6,"summary":"Repairing Prime has completed every capability, acceptance, generated-current, whole-Quest audit, and Phoenix recovery prerequisite. This restart-safe Sunset records the exact final pre-completion position at canonical main 848d84f54197aee0ed32c0ea8d5672651ac3db01.","superseded_direction":null},{"active_direction":null,"branched_from":null,"entry_id":"Final-Gate-007","entry_type":"FINAL","outcome":"RP-C08 and Repairing Prime were accepted COMPLETE/CLOSED from Sunset PR #224, lifecycle digest sha256:5bcdba556f9c40090176ab712cc868bc05cc1c47832261d10b9a54ac2da7384a, and generated NOOP receipt sha256:2722defc94f60dddaa35cae3faf66796cdf01c1ed1e100ffe10fece6c83b2565; the completed Quest was removed from active continuity.","reason":null,"returns_to":null,"scope":"GATE","sequence":7,"summary":"Repairing Prime reached its separately authorized final completion gate with all accepted evidence and boundaries preserved.","superseded_direction":null}],"latest_feather_id":"FTR-FYRBRXR57VWRYOZFORNP67R3H4","lineage_root_id":"QEM-R6QKBDHLY7I7PVVEKIGTZFMZZT","next_gate":"CLOSED","operation_ids":["operation-source-governance"],"project_id":"project-codex","protected_data":{"classification":"INTERNAL_CLEAN","clean_summary":"The final Repairing Prime Sunset contains only public-clean Atlas source references, sanitized evidence pointers, and no protected values.","protected_pointers":[]},"quest_id":"repairing-prime","quest_revision":4,"quest_state":"COMPLETE","record_id":"QEM-R6QKBDHLY7I7PVVEKIGTZFMZZT","revision_parent_digest":"sha256:628548a1ea044a5e18c0adef496f7bd2eba7cb243b3112efe9ec4923b0c2b7ff","schema_id":"atlas.lifecycle.quest-emberline","schema_version":"2.0.0","unresolved_blockers":[]}
